ET,SX,EX,Episode Title,Rating,Votes,Air Date,Description
130,7,5,Keep Bikini Bottom Beautiful/A Pal for Gary,3.3,601,01/02/2010,Squidward cleans up the city of Bikini Bottom with 'help' from SpongeBob.SpongeBob brings Gary a pet that terrorizes him.
131,7,6,"Yours, Mine and Mine/Kracked Krabs",6.2,299,09/11/2010,SpongeBob and Patrick buy a toy and have to learn to share it./SpongeBob goes with Mr. Krabs to the Cheapest Crab Convention.
132,7,7,The Curse of Bikini Bottom/Squidward in Clarinetland,7.6,299,03/24/2010,"When Squidward requires Mr. Krabs to give him extra space for his clarinet, he is forced to share a locker with Spongebob. But, his paranoia drives him ""literally"" crazy."
133,7,8,SpongeBob's Last Stand,7.0,280,04/22/2010,SpongeBob and Patrick protest the construction of a highway that would destroy Jellyfish Fields.
134,7,9,Back to the Past/The Bad Guy Club for Villains,7.5,291,02/15/2010,SpongeBob and Patrick go back in time to see the young Mermaidman and Barnacleboy.SpongeBob and Patrick watch their heroes fight bad guys in a classic Mermaidman and Barnacleboy episode.
135,7,10,A Day Without Tears/Summer Job,5.3,316,03/22/2010,Squidward bets SpongeBob he can't go a day without crying.Mrs. Puff has to work through her summer break at the Krusty Krab.
136,7,11,One Coarse Meal/Gary in Love,3.6,569,02/06/2010,Mr. Krabs finds out that Plankton's afraid of whales.Gary falls for a snail named Mary.
137,7,12,The Play's the Thing/Rodeo Daze,6.0,238,02/06/2010,Mr. Krabs opens a Dinner Theater at the Krusty KrabSpongeBob takes his pals to Texas to see Sandy in a squirrel rodeo.
138,7,13,Gramma's Secret Recipe/The Cent of Money,6.1,247,07/06/2010,Plankton disguises himself as SpongeBob's grandmother.Mr. Krabs uses Gary to find spare change.
139,7,14,The Monster Who Came to Bikini Bottom/Welcome to the Bikini Bottom Triangle,7.0,224,01/28/2011,Squidward's complaints trigger a volcanic eruption./SpongeBob and Patrick search for a drain on the ocean floor./A monster terrorizes Bikini Bottom./All the Bikini Bottom citizens disappear.
140,7,15,The Curse of the Hex/The Main Drain,6.6,180,06/11/2011,"Madam Hagfish puts a hex on the Krusty Krab, and SpongeBob and Patrick search for a legendary drain on the ocean floor."
141,7,16,Trenchbillies/Sponge-Cano!,5.5,197,01/28/2011,"Know what this is about?
 Be the first one to add a plot."
142,7,17,The Great Patty Caper,6.9,239,11/11/2010,"Includes three extra bonus shorts after the episode. SpongeBob, Patrick and Plankton solve a mystery on a runaway train."
143,7,18,That Sinking Feeling/Karate Star,6.9,250,07/08/2010,SpongeBob and Patrick dig a tunnel between their two houses and drive Squidward nuts.Pat learns just enough karate to wreak havoc in Bikini Bottom.
144,7,19,Buried in Time/Enchanted Tiki Dreams,7.3,291,02/06/2010,Mr. Krabs finds out that Plankton's afraid of whales.Gary falls for a snail named Mary.
145,7,20,The Abrasive Side/Earworm,7.3,268,11/27/2010,SpongeBob orders a product that will help him learn to say no; SpongeBob gets a song stuck in his head.
146,7,21,Hide and Then What Happens?/Shellback Shenanigans,6.4,173,08/09/2010,Plankton masquerades as Gary to steal the Krabby Patty formula./SpongeBob and Patrick play Hide N' Seek and SpongeBob searches the world for Patrick.
147,7,22,The Masterpiece/Whelk Attack,7.1,213,10/02/2010,Squidward sculpts a statue of Mr. Krabs for The Krusty Krab./Giant sea whelks terrorize the folks of Bikini Bottom.
148,7,23,You Don't Know Sponge/Tunnel of Glove,6.5,228,08/09/2010,Plankton masquerades as Gary to steal the Krabby Patty formula./SpongeBob and Patrick play Hide N' Seek and SpongeBob searches the world for Patrick.
149,7,24,Krusty Dogs/The Wreck of the Mauna Loa,7.0,246,10/09/2010,Mr. Krabs decides to start selling hot dogs instead of Krabby Patties./SpongeBob and Patrick discover a lost ship.
150,7,25,New Fish in Town/Love That Squid,6.5,184,02/12/2011,A new neighbor moves in and becomes Squidward's best friend./Spongebob helps Squidward prepare for a date.
151,7,26,Big Sister Sam/Perfect Chemistry,6.1,262,02/26/2011,Patrick's big sister Samantha comes for a visit./Sandy and Plankton bond over their shared love.
152,8,1,Accidents Will Happen/The Other Patty,7.1,263,06/25/2011,"When Squidward gets hurt on the job, he threatens to take legal action unless Mr. Krabs agrees to cater to him hand and foot. Mr. Krabs and Plankton find a common enemy in the popular new ""Flabby Patty"" restaurant."
153,8,2,Drive Thru/The Hot Shot,6.9,224,06/18/2011,"Accidents Will Happen: When Squidward gets hurt on the job, he threatens to take legal action unless Mr. Krabs agrees to cater to him hand and foot. Mr. Krabs and Plankton find a common enemy in the popular new ""Flabby Patty"" restaurant. Drive Thru: Instead of paying to patch up a hole in the wall of the Krusty Krab, Mr. Krabs decides to use it to make more money by turning it into a drive-thru window. Tony Fast, Jr., the son of a famous race car driver, teaches SpongeBob how to drive."
154,8,3,A Friendly Game/Sentimental Sponge,6.8,240,04/02/2011,SpongeBob and Patrick build an indoor miniature golf course in SpongeBob's house./SpongeBob has trouble throwing anything away when he realizes how many memories are attached to all his possessions.
155,8,4,Frozen Face-Off,7.4,247,07/15/2011,"All of Bikini Bottom enters a sleigh race to win $1 million. While racing, they are attacked by the abominable snow mollusk. Plankton takes advantage of everyone being gone to steal the Krabby Patty secret formula."
156,8,5,Squidward's School for Grown Ups/Oral Report,6.4,211,06/04/2011,"When Patrick suddenly grows a very grown-up beard, he decides it's time to act like a grown-up and perhaps Squiward is the perfect squid to help him. But can it be done without leaving SpongeBob heartbroken?/While preparing to give an oral report for boating school, SpongeBob comes down with stage fright. And Patrick doesn't seem to be any help at all, but Sandy does."
157,8,6,Sweet and Sour Squid/The Googly Artiste,6.4,178,07/20/2011,"Plankton tries to befriend Squidward so he can get the Krabby Patty formula.When an art critic deems Patrick a true artiste for his rocks-with-googly-eyes creations, everyone in Bikini Bottom clamors for a Patrick original."
158,8,7,SquarePants Family Vacation,6.1,198,11/11/2011,"While on a family road trip to the Great Barrier Reef, SpongeBob and Patrick get lost and end up on the adventure of a lifetime."
159,8,8,Patrick's Staycation/Walking the Plankton,6.4,188,11/07/2011,"Patrick wants to take a vacation, but can't afford one--until SpongeBob comes up with the perfect solution: a ""staycation""!Mr. Krabs and SpongeBob win a free cruise thanks to Plankton, who secretly goes with them to try to steal the Krabby Patty formula."
160,8,9,Mooncation/Mr. Krabs Takes a Vacation,6.9,165,11/09/2011,SpongeBob accidentally stows away on Sandy's vacation to the Moon.Mr. Krabs takes Pearl and SpongeBob on a vacation to the Ocean Mint.
161,8,10,Ghoul Fools,7.0,208,10/21/2011,SpongeBob and Patrick find a houseboat haunted by a crew of ghost pirates--and get caught in the feud between them and the Flying Dutchman.
162,8,11,Mermaid Man Begins/Plankton's Good Eye,7.5,217,09/23/2011,"SpongeBob and Patrick learn the secret origins of Mermaid Man and Branacle Boy from the heroes themselves. Plankton grows himself a second eye using SpongeBob's DNA, and becomes nice."
163,8,12,Barnacle Face/Pet Sitter Pat,5.1,252,09/16/2011,"Barnacle Face: The night before the big school dance, Mr. Krabs asks SpongeBob to help Pearl get rid of a barnacle on her face. Pet Sitter Pat: When SpongeBob gets invited to his Grandma's birthday party, he asks Patrick to pet-sit Gary."
164,8,13,House Sittin' for Sandy/Smoothe Jazz at Bikini Bottom,5.5,219,09/30/2011,SpongeBob house-sits for Sandy; SpongeBob and Squidward go to the Kelpy G concert.
165,8,14,The Way of the Sponge/Bubble Troubles,6.5,162,11/25/2011,SpongeBob and Patrick accidentally destroy Sandy's air supply and have to help her find more oxygen; SpongeBob wants to earn his belt from karate master Fuzzy Acorns with Sandy's help.
166,8,15,The Krabby Patty That Ate Bikini Bottom/Bubble Buddy Returns,6.5,177,11/25/2011,"Mr Krabs uses Sandy's experimental growth formula on a Krabby Patty with disastrous results.SpongeBob tries to keep Bubble Buddy's visiting son, Shiny, out of trouble and away from sharp edges."
167,8,16,Restraining SpongeBob/Fiasco!,6.0,184,04/02/2012,"Squidward has had enough of SpongeBob's annoying antics and issues a restraining order against him.Plankton thinks he's stolen a Krabby Patty from the Krusty Krab, but he's really stolen an art piece by the famous artist, Fiasco."
168,8,17,Are You Happy Now?/Planet of the Jellyfish,6.6,205,03/31/2012,Squidward has trouble recalling his happiest memory; SpongeBob and Sandy must defeat an evil Jellien overlord who has replaced everyone with clones.
169,8,18,Free Samples/Home Sweet Rubble,6.6,187,04/04/2012,Mr. Krabs is forced to give out free food to win back customers. SpongeBob needs all of his friends to help him remodel his pineapple.
170,8,19,Karen 2.0/InSpongeiac,6.9,227,04/09/2012,"When Plankton replaces his computer wife Karen with the new, better Karen 2, the original Karen ends up working at the Krusty Krab. / SpongeBob can't get to sleep, and asks for help from Patrick... who can't stay awake."
171,8,20,Face Freeze!/Glove World R.I.P.,5.4,301,04/03/2012,"SpongeBob and Patrick make a bet to see who can hold a ""funny face"" the longest...then their faces freeze that way!SpongeBob and Patrick spend one last glorious - and dangerous - day at Glove World before it closes for good."
172,8,21,Squiditis/Demolition Doofus,4.7,311,04/11/2012,"When Squidward goes home sick with a fake illness, SpongeBob HypochondriacPants thinks he's caught it for real!Mrs. Puff finally finds a use for SpongeBob's reckless driving and enters him in the Demolition Derby!"
173,8,22,Treats!/For Here or to Go,7.0,190,04/10/2012,"SpongeBob brings home a box of new snail treats that Gary will do anything to get - especially when they run out. / Plankton wins a free Krabby Patty, and Mr. Krabs will do anything to stop him from collecting."
174,8,23,It's a SpongeBob Christmas!,7.2,776,11/23/2012,"Plankton, Mr. Krabs' nemesis, vows to get his Christmas wish - obtaining the Krusty Krab's secret Krabby Patty formula - by turning everyone bad in Bikini Bottom with the help of his special jerktonium-laced fruitcake."
175,8,24,Super Evil Aquatic Villain Team Up Is Go!/Chum Fricassee,7.1,168,10/27/2012,"Plankton teams up with Man Ray to take over the Krusty Krab. Squidward quits his job and starts working at the Chum Bucket, where his new chum recipe becomes a success."
176,8,25,The Good Krabby Name/Move It or Lose It,6.9,150,10/21/2012,"Who lives in a pineapple under the sea? SpongeBob SquarePants! Follow the adventures of this enthusiastic, optimistic sponge whose good intentions inevitably lead him and his friends into trouble."
177,8,26,Hello Bikini Bottom!,7.3,207,10/08/2012,"SpongeBob and Squidward form a band and go on tour with Mr. Krabs as their manager and Patrick as their roadie, but they experience several difficulties along the way."
178,9,1,Extreme Spots/Squirrel Record,6.7,296,07/21/2012,"SpongeBob and Patrick attempt to join Johnny Krill's extreme sports team. Sandy is determined to break a record number of world records, in record time, so SpongeBob joins her for an action-packed weekend of dangerous record setting."
179,9,2,Patrick-Man!/Gary's New Toy,6.9,245,10/14/2012,"Patrick becomes the superhero Patrick-Man, who intends to clean up Bikini Bottom--whether it wants it or not! Gary becomes obsessed with his new red ball, forcing SpongeBob to take drastic measures to intervene."
180,9,3,License to Milkshake/Squid Baby,6.1,241,09/07/2012,SpongeBob must return to the Milkshake Academy after he realizes his Milkshake License has expired. / Squidward suffers a head injury and gets the mind of an infant.
181,9,4,Little Yellow Book/Bumper to Bumper,5.3,311,11/25/2012,"Squidward finds SpongeBob's diary, and starts reading it out loud in the Krusty Krab.SpongeBob once again fails his driving test, forcing Mrs. Puff to think outside the box--and off the road."
182,9,5,"Eek, an Urchin!/Squid Defense",6.8,211,10/28/2012,"SpongeBob finds a nasty sea urchin living in the Krusty Krab, and tries everything to force it out. After getting his groceries stolen, Squidward convinces SpongeBob and Sandy to teach him karate."
183,9,6,Jailbreak!/Evil Spatula,7.8,198,03/16/2013,"An imprisoned Plankton teams up with his fellow inmates to break out of jail and steal the Krabby Patty secret formula. / SpongeBob replaces his broken spatula with one from Plankton, which may or may not have magical powers."
184,9,7,It Came from Goo Lagoon,7.2,193,02/17/2014,"What do microwave ovens, dry cleaning, corn dogs and purple floaty things have in common? They can all destroy Bikini Bottom, that's what! But will they? Find out in this spine-tingling SpongeBob SquarePants adventure, It Came From Goo Lagoon! Horrors. A giant purple ball of goo has risen from the deep and it's threatening to release its toxic, gooey wrath all over the city. And according to Sandy, Bikini Bottom's resident know-it-all, this is not good. What's worse, Plankton has big, evil plans for this bubble. Will harnessing the bubble's power finally get Plankton ..."
185,9,8,Safe Deposit Krabs/Plankton's Pet,8.1,234,01/19/2013,"Mr. Krabs gets trapped in Bikini Bottom's brand-new bank, and it's up to SpongeBob and Patrick to save him. After failing again to steal the Krabby Patty formula, Plankton gets a pet to cheer himself up."
186,9,9,Don't Look Now/Sรฉance Shmรฉance,7.8,211,10/14/2013,"SpongeBob and Patrick go to see the latest horror film, only to be seemingly stalked by the villain. SpongeBob holds a sรฉance at the Krusty Krab to learn the recipe for a long-lost sandwich."
187,9,10,Kenny the Cat/Yeti Krabs,6.9,217,03/29/2014,"Spongebob is desperate to meet his newest hero, Kenny the Cat. Mr. Krabs tries to scare Squidward into working harder."
188,9,11,"SpongeBob, You're Fired",4.9,484,11/11/2013,"In order to save money, Mr. Krabs fires SpongeBob; however, unable to just ""do nothing"", SpongeBob decides to go back to work, no matter what - or where."
189,9,12,Lost in Bikini Bottom/Tutor Sauce,8.0,391,07/16/2015,"Lost in Bikini Bottom: On his way to work, SpongeBob attempts to take a shortcut to get there quicker, only to find himself in an abandoned area of Bikini Bottom, and unable to find his way out. Tutor Sauce: After failing his drivers test, SpongeBob consults Mr. Krabs for driving lessons. Even with the experience Mr. Krabs gained from teaching his daughter, SpongeBob would prove it to be a difficult task for Mr. Krabs to teach him."
190,9,13,Squid Plus One/The Executive Treatment,8.0,359,09/07/2015,"Squid Plus One: Squidward gets invited to a gallery opening and wants to take someone, but can't decide who. The Executive Treatment: Patrick takes on a career of business when he tries to order a special sandwich."
191,9,14,Company Picnic/Pull Up a Barrel,8.0,364,09/18/2015,"Company Picnic: In order to boost morale, Mr. Krabs throws a company picnic - On the same day Plankton is hosting his own. Pull Up a Barrel: It's a stormy day in Bikini Bottom while SpongeBob and Squidward are at work, so Mr. Krabs tells them stories of his days in the Navy."
192,9,15,Sanctuary!/What's Eating Patrick?,7.9,373,10/02/2015,"When stray snails start appearing around Bikini Bottom, SpongeBob decides to care for them himself. To defend Bikini Bottom's honor, Patrick enters a Krabby Patty eating competition."
193,9,16,Patrick! The Game/The Sewers of Bikini Bottom,8.0,384,11/11/2015,"Patrick invents a new board game, and invites SpongeBob, Sandy and Squidward to play it with him. After accidentally flushing Mr. Krabs' safe, SpongeBob and Squidward must go into the sewers to find it."
194,9,17,SpongeBob LongPants/Larry's Gym,7.7,385,02/15/2016,"SpongeBob gets a pair of long pants, but they change his life in unexpected ways. When Larry the Lobster opens a new gym in Bikini Bottom, SpongeBob becomes his best customer."
195,9,18,The Fish Bowl/Married to Money,7.5,344,05/02/2016,"Sandy tries to study SpongeBob and Patrick's behavior, but her science experiment goes horribly awry. Mr. Krabs takes Plankton's advice, and finally marries the only thing he ever loved...money!"
196,9,19,Mall Girl Pearl/Two Thumbs Down,8.1,375,03/12/2016,"In ""Mall Girl Pearl,"" Pearl must find a job to be cool like her friends, but, the only place hiring is the mall's lamest store. In ""Two Thumbs Down,"" SpongeBob loses the use of his thumbs, making his life difficult."
197,9,20,Sharks vs. Pods/CopyBob DittoPants,8.2,352,05/04/2016,"""The Sharks"" are the toughest guys in town, but their next confrontation might be too much for SpongeBob to handle. Plankton clones SpongeBob in an effort to steal Krabs' secret formula, but original Bob might ruin his plans."
198,9,21,Sold!/Lame and Fortune,8.1,327,05/06/2016,"SpongeBob and Patrick see a commercial and believe their houses are sold. The Krusty Krab starts selling fortune cookies, but Plankton decides to use them for his evil schemes."
199,9,22,"Goodbye, Krabby Patty?",8.2,285,02/20/2017,"In order to save money, Mr. Krabs talks to the Ad Executive, Don Grouper, and launches a line of Frozen Krabby Patties."
200,9,23,Sandy's Nutmare/Bulletin Board,8.4,302,07/12/2016,"Sandy creates the latest acorn-based food sensation, but her tree pays the price for her greed. SpongeBob erects a community bulletin board in the Krusty Krab, but anonymous reviews posted on it lead to trouble."
201,9,24,Food Con Castaways/Snail Mail,8.1,273,07/13/2016,"The gang heads to a food convention, but things go awry when they become stranded in the woods. SpongeBob accidentally fibs to his pen pal, but when his friend comes to visit, he must keep the ruse going!"
202,9,25,Pineapple Invasion/Salsa Imbecilicus,8.1,272,06/14/2016,"When SpongeBob hides the secret formula in his home, it's up to Gary to protect it from Plankton. When a freak accident causes everyone in town to become as stupid as Patrick, Sandy must save the day."
203,9,26,Mutiny on the Krusty/The Whole Tooth,8.1,274,10/08/2016,"When the Krusty Krab is blown away by a storm, an insane Mr. Krabs has to guide his employees and customers back to their homes. Patrick is forced to lose his last baby tooth, but he is frightened."
204,10,1,Whirly Brains/MermaidPants,7.6,385,10/15/2016,"SpongeBob and Patrick get hooked on the latest fad - flying your own brain like a tiny drone! When SpongeBob & Patrick play Mermaidman and Barnacleboy, it's all fun and games until their sworn enemies arrive."
205,10,2,Unreal Estate/Code Yellow,8.3,322,06/03/2017,"In order to get SpongeBob to move away, Squidward puts black pepper all over SpongeBob's house to make him think he's allergic to his home; Squidward decides to get a nose job at the hospital, and SpongeBob volunteers as a doctor."
206,10,3,Mimic Madness/House Worming,8.2,406,02/25/2017,"SpongeBob imitates everyone for fun, but it goes too far once SpongeBob gets ""Mocking Mimicry Madness""/A worm named Prickles goes inside SpongeBob, and brings uninvited guests."
207,10,4,Snooze You Lose/Krusty Katering,8.2,414,03/04/2017,"Squidward becomes so tired that SpongeBob and Patrick can't wake him up. However, they will not let him miss his big audition; Mr. Krabs and his crew cater a fancy party, but they might be out of depth with their new wealthy customers."
208,10,5,SpongeBob's Place/Plankton Gets the Boot,8.2,342,03/11/2017,"When SpongeBob cooks at home, Mr. Krabs' customers leave his restaurant and head for SpongeBob's Place. When Plankton gets kicked out of the house, it's up to SpongeBob to teach him how to win his computer wife back."
209,10,6,Life Insurance/Burst Your Bubble,8.3,329,03/18/2017,"A misunderstanding leaves Spongebob and Patrick to think Life Insurance will protect them from any danger; Spongebob blows himself a bubble boat, and Mrs. Puff tries to stop Spongebob."
210,10,7,Plankton Retires/Trident Trouble,8.0,322,03/25/2017,"Plankton decides to close the Chum Bucket and move to a new town, but Mr. Krabs still suspects he is up to something./SpongeBob accidentally picks up King Neptune's magic trident."
211,10,8,The Incredible Shrinking Sponge/Sportz?,7.9,329,12/02/2017,SpongeBob must figure out how to do his job after accidentally shrinking himself; Squidward invents a new sport to get back at SpongeBob and Patrick for annoying him.
212,10,9,The Getaway/Lost and Found,8.2,318,06/10/2017,"When SpongeBob mistakes an escaped convict for his driving instructor, it's the new teacher who learns a lesson; Mr. Krabs sends SpongeBob in search of a missing toy, and SpongeBob finds himself lost in the lost-and-found."
213,10,10,Patrick's Coupon/Out of the Picture,5.1,428,06/17/2017,"Patrick has a coupon for free ice cream, but he has to get to the store if he wants to use it; Mr. Krabs buys Squidward's art, but to make a profit on his purchase, he will have to get the artist out of the picture."
214,10,11,Feral Friends/Don't Wake Patrick,8.2,347,10/07/2017,"A weird moon turns everyone in the city into wild animals, and Sandy is the only one who can save them. Patrick sleepwalks and SpongeBob can't wake him up."
215,11,1,Cave Dwelling Sponge/The Clam Whisperer,7.9,435,09/23/2017,"When a prehistoric Sponge is unfrozen, he causes chaos all over town - and only SpongeBob can communicate with him! When a flock of clams descend on Bikini Bottom, SpongeBob has to get them out before they ruin the whole town!"
216,11,2,Spot Returns/The Check-Up,8.2,337,06/24/2017,"Plankton's pet amoeba Spot has babies and decides to use them in one of his evil schemes/Mr. Krabs has to get a medical exam, but he's too afraid. However, if he doesn't get it, the Krusty Krab will have to be shut down."
217,11,3,Spin the Bottle/There's a Sponge in My Soup,7.9,334,07/16/2017,Plankton poses as a wish-granting genie in his latest scheme to get the secret formula. Mr. Krabs' new Krabby soup is a hit - until some heat-loving hippies move into the soup vat!
218,11,4,Man Ray Returns/Larry the Floor Manager,7.9,422,09/30/2017,"When Man Ray rents Squidward's house for the weekend, it's up to SpongeBob and Patrick to stop his evil vacation! Mr. Krabs takes a vacation and makes Larry the Lobster the temporary manager of the Krusty Krab."
219,11,5,The Legend of Boo-Kini Bottom,8.3,351,10/13/2017,"SpongeBob and friends don costumes and decorate their neighborhood for some Halloween fun, but the spooky Flying Dutchman has other plans."
220,11,6,No Pictures Please/Stuck on the Roof,7.9,310,11/06/2017,"Patrick leads an enthusiastic stranger on a tour of his favorite places in Bikini Bottom; SpongeBob is afraid to get off the roof of the Krusty Krab, but he won't let that stop him from living his life."
221,11,7,Krabby Patty Creature Feature/Teacher's Pests,7.9,348,10/21/2017,"A new secret Krabby Patty formula has disastrous results for Bikini Bottom, and only SpongeBob can save the day. Mr. Krabs and Plankton have to take boating school classes. Thankfully, SpongeBob's there to show them the ropes!"
222,11,8,Sanitation Insanity/Bunny Hunt,7.0,265,11/10/2017,"When Mr. Krabs gets in trouble for littering, he makes SpongeBob and Squidward clean up Bikini Bottom; A sea bunny ravages Squidward's garden, but SpongeBob thinks it's cute."
223,11,9,Squid Noir/Scavenger Pants,8.3,298,11/10/2017,"When Squidward's clarinet disappears, he has to become a hard-boiled detective to track it down; Squidward sends SpongeBob and Patrick on a difficult scavenger hunt to get them out of his hair."
224,11,10,Cuddle E. Hugs/Pat the Horse,6.9,296,12/02/2017,"SpongeBob's new friend is a giant, fluffy hamster that no one else can see; Patrick wants to be a horse."
225,11,11,Chatterbox Gary/Don't Feed the Clowns,7.4,254,02/12/2018,"Gary has a pet translation collar, and he's talking up a storm; When a small clown gets left behind by the circus, SpongeBob takes the hapless harlequin under his wing."
226,11,12,Drive Happy/Old Man Patrick,7.7,254,02/13/2018,"SpongeBob can't drive, but you don't need a license to operate a self-driving car! Patrick thinks he's an old man, so it's up to SpongeBob to remind him how much fun being a kid can be!"
227,11,13,Fun-Sized Friends/Grandmum's the Word,7.4,261,02/15/2018,"SpongeBob and Patrick exchange tiny living versions of themselves. Plankton lies to his grandma, telling her that he owns the Krusty Krab to fulfill a promise he made, but must keep the lie going when she comes to visit."
228,11,14,Doodle Dimension/Moving Bubble Bass,7.7,253,03/09/2018,"SpongeBob and Patrick become trapped in an alternate dimension, where anything they draw comes to life. SpongeBob and Patrick help Bubble Bass move out of his mother's basement."
229,11,15,High Sea Diving/Bottle Burglars,7.6,231,04/13/2018,"SpongeBob wants to be the first sponge that dives to the surface of the ocean. SpongeBob and Squidward accidentally let Plankton slip away with the formula, and it is up to them to retrieve it."
230,11,16,My Leg!/Ink Lemonade,4.9,426,05/09/2018,"Once Fred's leg heals up, SpongeBob is determined to keep it out of harm's way. Patrick's lemonade stand is unsuccessful until he gets a secret ingredient from Squidward."
231,11,17,Mustard O' Mine/Shopping List,7.8,226,05/10/2018,"When the Krusty Krab runs out of mustard, Mr. Krabs sends SpongeBob, Patrick and Squidward to dig up some more. SpongeBob and Sandy have to collect Krabby Patty ingredients, but Plankton follows their every step."
