ET,SX,EX,Episode Title,Rating,Votes,Air Date,Description
232,11,18,Whale Watching/Krusty Kleaners,8.2,233,08/06/2018,"Mr. Krabs hires Squidward to babysit Pearl for the night, but she just wants to sneak out to a cool teen party; after spilling a milkshake during a delivery, SpongeBob vows to return and clean the entire building."
233,11,19,Patnocchio/ChefBob,6.5,240,08/08/2018,"Plankton tells Patrick he's his conscience so he can convince the wooden-headed star to steal him a Krabby Patty. When Mr. Krabs puts in an open kitchen, SpongeBob gets stage fright and has to invent a new persona."
234,11,20,Plankton Paranoia/Library Cards,6.7,213,09/26/2018,"Plankton hasn't tried to steal the secret formula in a while - and that's making Mr. Krabs nervous. When Patrick discovers the pineapple's library, SpongeBob introduces him to the wonderful world of book learning."
235,11,21,Call the Cops/Surf n' Turf,6.2,214,09/27/2018,"Plankton goes to jail, but the secret formula is taken as evidence, so SpongeBob and Mr. Krabs plot to get it back. Sandy struggles to build a ship-in-a-bottle before a big contest, so SpongeBob calls in a little extra help."
236,11,22,Goons on the Moon,7.9,198,11/25/2018,Sandy takes her Science Scout troop on a trip to the moon.
237,11,23,Appointment TV/Karen's Virus,8.0,210,10/28/2018,"The long-lost episode of Mermaid Man is finally showing on TV, but SpongeBob may not make it home in time to watch. Karen gets a computer virus, and it's up to SpongeBob to get it out of her."
238,11,24,The Grill is Gone/The Night Patty,6.9,223,10/21/2018,"When a gang of kids steal the Krusty Krab's grill, SpongeBob and Mr. Krabs go to extreme lengths to win it back. SpongeBob helps out the Krusty Krab's night shift crew, but the customers crave something creepier than usual."
239,11,25,Bubble Town/Girls' Night Out,6.6,213,11/04/2018,"SpongeBob visits his old friend Bubble Buddy in his new hometown. Sandy invites Karen and Mrs. Puff out for a night on the town, so the ladies decide to blow off some steam."
240,11,26,Squirrel Jelly/The String,7.9,216,11/18/2018,SpongeBob and Patrick have their peaceful day of jellyfishing disturbed by Sandy's competitive nature; SpongeBob pulls a loose string from Squidward's shirt that never seems to end.
