ET,SX,EX,Episode Title,Rating,Votes,Air Date,Description
77,4,17,Driven to Tears/Rule of Dumb,7.0,344,02/19/2007,"Driven to Tears: SpongeBob has failed his driving test-again. Patrick is so outraged by the injustice of it all that he storms into the testing facility and takes the test to prove that it is an unfair test and impossible to pass. Only Patrick DOES pass, and now he's getting his license. But that's not all. Because Patrick is the 1-millionth customer at the DMV, he is awarded a brand new car! SpongeBob tries to be happy for his pal. But watching Patrick abuse his driving privilege and disobey common driving 101 rules makes the Sponge's blood boil. Rule of Dumb: An ..."
78,4,18,Born to Be Wild/Best Frenemies,7.8,374,03/31/2007,"Born to be Wild: SpongeBob hears that a ferocious biker gang is coming to town, only no one in Bikini Bottom seems bothered by the news. So SpongeBob dons his leather jacket, warms up his bike, and prepares to protect the town all by himself. Best Frenemies: A new Kelp Smoothie chain is opening up all over Bikini Bottom. The chain's smoothies are so delicious that soon everyone in town can be seen drinking one. But now that customers already have their smoothie, they don't need to buy a beverage with their Krusty Krab order. This could hurt Mr. Krabs' profits, and if ..."
79,4,19,The Pink Purloiner/Squid Wood,7.2,350,02/19/2007,"The Pink Purloiner: SpongeBob's favorite jellyfishing net is missing! And worst of all, Patrick may have been the one that stole it. But SpongeBob can't accuse his friend of anything until he can find some hard evidence that the starfish does indeed have the net. Squid Wood: Rejected yet again by Squidward, SpongeBob decides that if he can't hang with the real Squidward, he'll make his own. So SpongeBob builds a ventriloquist dummy modeled after his favorite neighbor. At first Squidward is pleased that SpongeBob is distracted by this mini Squidward. But eventually ..."
80,4,20,Best Day Ever/The Gift of Gum,6.9,441,11/10/2006,"Best Day Ever: SpongeBob is going to have the best day ever. First he gets to work at the Krusty Krab. Then he is going to meet Sandy for a little Ka-Ra-Tay, followed by jellyfishing with Patrick, and Squidward's clarinet recital. But the day does not go exactly as planned. Each of his friends is having a problem which SpongeBob naturally sets out to solve. But this costs him every item on his perfect agenda. When a disappointed SpongeBob realizes that his entire day has been sacrificed, his friends rally around him to give their thanks and make sure his day really is..."
81,5,1,Friend or Foe,8.1,457,04/13/2007,"Mr. Krabs and Plankton have been business rivals and bitter enemies for longer than anyone can remember, but, one day, during another one of Plankton's failed attempts at stealing the Krabby Patty formula, Mr. Krabs reveals that they were not always this way. There was a time when the two rivals were actually the best of friends. Through a series of flashbacks, Mr. Krabs tells the tale of how that great friendship turned sour, and how the Krabby Patty was born in the process."
82,5,2,The Original Fry Cook/Night Light,7.3,387,07/30/2007,"The Original Fry Cook: Mr. Krab's old fry cook pays a special visit to the Krusty Krab. SpongeBob is in awe of his predecessor, who has since become a world renowned chef following his departure from Krabs' restaurant. When SpongeBob tries to impress the impressive chef, he instead finds his fry cook skills are in question. Taking the chef's critique to heart, SpongeBob decides to quit - his beloved Krusty Krab deserves someone better. Without his employee of the month, Krabs is stuck with an overpriced chef that will charge him an arm and a leg to flip one burger. He..."
83,5,3,Rise and Shine/Waiting/Fungus Among Us,6.4,369,02/19/2007,"Rise and Shine: Take a look inside Patrick Star's rock where we see that his morning routine is anything but ordinary. Waiting: SpongeBob discovers that his breakfast cereal has an offer for free toy. After gathering the necessary proofs of purchase, SpongeBob mails his requests. But now the hardest part is upon him: waiting for the toy to arrive. So SpongeBob sets up camp right next to his mailbox, determined to be present when the mailman shows up with his treasure."
84,5,4,Spy Buddies/Boat Smarts/Good Ol' Whatshisname,7.1,350,07/23/2007,"Spy Buddies: Determined to uncover Plankton's next devious plot, Mr. Krabs sends SpongeBob and Patrick to spy on him. Boat Smarts: Watch an instructional video on the best (and worst) boating techniques as demonstrated by Squidward and SpongeBob. Good Ol' Whatshisname: Mr. Krabs holds a contest for his employees: The first one to learn the names of every Krusty Krab customer wins a tropical vacation."
85,5,5,New Digs/Krabs รก la Mode,8.1,370,07/25/2007,"New Digs: After arriving one minute late for work, SpongeBob decides to move into the Krusty Krab so that he will never be late to work again. Krabs a la Mode: When Plankton secretly turns down the thermostat at the Krusty Krab the entire restaurant freezes over. But with a couple of frozen Krabby Patties tied to his shoes for skates, SpongeBob turns the frozen floor into an ice skating rink - and Mr. Krabs charges money for it."
86,5,6,"Roller Cowards/Bucket, Sweet Bucket",8.0,360,07/27/2007,"Roller Cowards: The scariest roller coaster ever has just opened at Bikini Bottom's amusement park. At first SpongeBob and Patrick are determined to ride this monster coaster. But the more they think about how scary it is the more they chicken out. Bucket, Sweet Bucket: Plankton tricks SpongeBob, Patrick and Squidward into fixing up the Chum Bucket with a series of sob stories."
87,5,7,To Love a Patty/Breath of Fresh Squidward,5.8,404,07/26/2007,SpongeBob has trouble letting go of a perfect krabby patty; Squidward's personality changes when his security fence electrocutes him.
88,5,8,Money Talks/SpongeBob vs. The Patty Gadget/Slimy Dancing,7.0,336,07/31/2007,"Money Talks: Mr. Krabs makes a wish that he could talk to money. When his wish is magically granted, Mr. Krabs learns (to his horror) what all of his dollars, pennies and quarters have been longing for: they want Mr. Krabs to spend them. SpongeBob vs. Patty Gadget: SpongeBob competes against a patty-making machine. It's SpongeBob vs. a robot fry cook to see who's best, sponge or machine? Slimy Dancing: Squidward trains SpongeBob for the Bikini Bottom dance contest and ends up hiding inside SpongeBob during the dance competition."
89,5,9,The Krusty Sponge/Sing a Song of Patrick,7.7,349,02/19/2007,"The Krusty Sponge: SpongeBob becomes the latest local obsession after a notable food critic gives him high ratings. Now Mr. Krabs is looking to cash in on the fad by making everything in the Krusty Krab Sponge-themed. Sing a Song of Patrick: SpongeBob helps Patrick get his song some air time at the local radio station. But the song Patrick wrote is so bad, an angry mob attacks him."
90,5,10,A Flea in Her Dome/The Donut of Shame/The Krusty Plate,7.1,339,08/01/2007,"A Flea in Her Dome: Sandy comes back from Texas with fleas and SpongeBob and Patrick try to help Sandy rid her Tree Dome of them. The Donut of Shame: When Patrick accidentally takes SpongeBob's donut he is wracked with guilt over his heinous crime. The Krusty Plate: During an evening of washing dishes at the Krusty Krab, SpongeBob battles a persistent speck of food that is affixed to one of the dinner plates."
91,5,11,Goo Goo Gas/Le Big Switch,7.1,309,09/29/2007,"Goo Goo Gas: Plankton plans on making Mr. Krabs helpless by turning him and the rest of the Krusty Krab staff into babies with a gas he created. Le Big Switch: After being enrolled in a chef exchange program, SpongeBob switches places with a snooty French chef from a high-end restaurant."
92,5,12,Atlantis SquarePantis,5.8,652,11/12/2007,"When two halves of an ancient medallion reunite, SpongeBob and his friends find themselves in the city of Atlantis, where the king gives them a tour."
93,5,13,Picture Day/Pat No Pay/Blackjack,6.6,327,08/02/2007,"Picture Day: It's Picture Day for the Boating School Year Book, and SpongeBob has spent all morning getting ready for it. Now all he has to do is make it to Boating School without getting dirty. But this proves to be more difficult than SpongeBob imagined. Pat No Pay: When Patrick eats his weight in Krabby Patties without paying, Mr. Krabs puts him to work in the restaurant. Blackjack: SpongeBob's parents are missing. All clues of their whereabouts point to his nefarious cousin Blackjack, the family bully who used to torment SpongeBob when they were little. If ..."
94,5,14,Blackened Sponge/Mermaidman vs. SpongeBob,7.3,313,08/03/2007,"Blackened Sponge: While trying to wrestle open the cap off of a tube of toothpaste SpongeBob accidentally punches himself in the face leaving behind a hideous black eye. Too embarrassed to tell anyone the truth behind the shiner, SpongeBob makes up a tale about a fight with a giant thug. But unbeknownst to SpongeBob, the bully in his story really exists, and he is not happy about this fictitious rumor that's going around about him. Mermaidman vs. SpongeBob: Plankton has brainwashed Mermaidman and Barnacleboy! With the dynamic duo under Plankton's control, he orders ..."
95,5,15,The Inmates of Summer/To Save a Squirrel,7.6,347,11/23/2007,"The Inmates of Summer: Instead of getting on the ship headed for summer camp, SpongeBob and Patrick accidentally board a ship full of prisoners on their way to jail on Inferno Island. To Save a Squirrel: SpongeBob and Patrick stow away on one of Sandy's extreme wilderness expeditions. But when they get accidentally left behind, they must band together in order to survive in the wild."
96,5,16,Pest of the West,7.2,322,04/11/2008,"Pest of the West: While researching his family tree SpongeBob discovers that he was related to the great Western hero, and famous chili-slinger, SpongeBuck. The tale of his ancestor's fame begins in the town of Dead Eye Gulch, which used to be called Bikini Gulch before the no-good Dead Eye Plankton came along. Everything in town has been taken over by Dead Eye - everything except Pappy Krabs' Krusty Kantina, the local watering hole where Hopalong Squidward can be found working behind the counter serving customers like Pecos Patrick. But now that Dead Eye has his big ..."
97,5,17,"20,000 Patties Under the Sea/The Battle of Bikini Bottom",7.1,326,11/23/2007,"20,000 Patties Under the Sea: SpongeBob and Mr. Krabs turn an old submarine into a mobile Krusty Krab. Not to be undone by his competitor's new gimmick, Plankton responds with his own traveling Chum Bucket, and the two rival restaurants engage in an undersea battle complete with torpedoes, a giant sea monster and chum. The Battle of Bikini Bottom: When Patrick and SpongeBob discover they have clashing views on cleanliness, their disagreement blows up into an epic battle. Is it possible for a soap-lover like SpongeBob to ever be friends with a dirt-monger like Patrick?"
98,5,18,Whatever Happened to SpongeBob? (WhoBob WhatPants),6.3,386,10/13/2008,"Whatever Happened to SpongeBob? (WhoBob WhatPants): When SpongeBob tries to spend some quality time with his friends, he just ends up being a nuisance to everyone instead. They all tell him to go away, so with a heavy heart, SpongeBob decides to do just that-he packs up to leave Bikini Bottom forever. Along the way, SpongeBob takes a nasty tumble and bumps his head, making him lose his memory. He doesn't remember anything, not even his own name. With nothing but a bottle of bubbles in his pocket, SpongeBob stumbles into New Kelp City. Lost and confused, he does the ..."
99,5,19,The Two Faces of Squidward/SpongeHenge,7.3,355,11/23/2007,"The Two Faces of Squidward: Squidward is rushed to the hospital when SpongeBob accidentally slams the door on Squidward's face. He undergoes surgery to have his face fixed to look normal again-but things don't go exactly as planned. Instead of looking like his old self again, the surgery has made him incredibly handsome! His dazzling beauty is making everyone in Bikini Bottom fall head over heels for the new Squidward. SpongeHenge: A very windy day in Bikini Bottom is blowing air through SpongeBob's holes resulting in a chorus of pretty flute-like sounds. This ..."
100,5,20,Banned in Bikini Bottom/Stanley S. SquarePants,6.8,336,11/23/2007,"Banned in Bikini Bottom: SpongeBob loves Krabby Patties so much, he just can't help singing and dancing when he's around the delicious sandwiches. But Miss Priss, who is against all things fun and delicious, is appalled by his behavior and has Krabby Patties banned from Bikini Bottom! Stanley S. SquarePants: When Stanley, SpongeBob's klutzy, absent-minded cousin, comes to visit Bikini Bottom, he quickly turns SpongeBob's life upside down."
101,6,1,House Fancy/Krabby Road,6.7,365,03/03/2008,"House Fancy: Squidward is enraged when he sees the home of his rival, Squilliam featured on a TV show about fancy houses. Determined not to be outdone, Squidward arranges to have his own house on the program. But he quickly realizes that his house isn't exactly camera-ready and he's going to need a lot of help, even if it means letting SpongeBob redecorate. Krabby Road: When SpongeBob mistakenly thinks that Plankton is starting a band, Plankton decides to use this to advantage. He soon forms a rock band with SpongeBob, Patrick, and Squidward. Plankton's plan: get ..."
102,6,2,Penny Foolish/Nautical Novice,6.3,304,03/07/2008,"Penny Foolish: When Mr. Krabs sees SpongeBob pick a penny up off the street, he becomes obsessed with the coin and vows to have it in his possession no matter what it takes. Nautical Novice: SpongeBob's boating school class is going on a field trip to the Nautical Museum-a perfect opportunity for SpongeBob to show off his boating know-how to Mrs. Puff! SpongeBob is convinced that once she sees just how knowledgeable he is about boating history, Mrs. Puff is sure to give him his license! Now all he needs to do is memorize the entire history of boating in one night."
103,6,3,Spongicus/Suction Cup Symphony,7.1,297,03/06/2008,"Spongicus: Plankton has demolished the Chum Bucket! In its place, he has built a Roman coliseum and announces there will be a gladiator show, which means togas, chariots, and ferocious lionfish. And on top of all that, it's free! No one in Bikini Bottom can resist, not even Mr. Krabs! Suction Cup Symphony: The Bikini Bottom Symphony is accepting submissions for their composition contest, and Squidward is determined to win. He immediately gets to work on his masterpiece, but when SpongeBob and Patrick keep disrupting Squidward's concentration, it looks like they might ..."
104,6,4,Not Normal/Gone,7.2,337,03/04/2008,"Not Normal: When Squidward points out to SpongeBob that he's not normal, SpongeBob makes it his mission to become normal. SpongeBob begins to lose all his spongey-ness, and it's not long before he's completely unrecognizable, even to his best friends. Could this be the end of SpongeBob SquarePants as we know him? Gone: SpongeBob wakes up one morning to find that everyone in Bikini Bottom is gone - even Gary!"
105,6,5,The Splinter/Slide Whistle Stooges,3.9,553,06/02/2008,"SpongeBob tries to remove a splinter before Mr. Krabs learns about it and sends him home early; SpongeBob and Patrick get new slide whistles and keep playing them, much to the annoyance of Squidward."
106,6,6,A Life in a Day/Sun Bleached,6.9,297,06/04/2008,"A Life in a Day: Everyone is in awe of Larry the Lobster's daredevil ways, especially SpongeBob and Patrick. Patrick decides that it's time for them to start living like Larry, but SpongeBob isn't so sure. Sun Bleached: Everybody who's anybody is going to a big party in Bikini Bottom, but you have to be a certain shade of tan to get in. SpongeBob and Patrick decide to get tan so they can go to the party, but SpongeBob accidentally goes too far and turns sun-bleached white! Now, not only is he the wrong shade, but he can barely move without cracking and turning to dust."
107,6,7,Giant Squidward/No Nose Knows,6.6,280,06/03/2008,"Giant Squidward: When Squidward gets spritzed with plant growth spray, he becomes monstrously huge. SpongeBob and Patrick are thrilled because they now have a giant buddy to play games with. But the citizens of Bikini Bottom are terrified of the monster, and they want him out! No Nose Knows: When Patrick realizes that he is the only one out of all his friends without a nose, he decides he needs to get a nose, too. Patrick is soon introduced to a whole new world full of aromas-including the stinky ones."
108,6,8,The Patty Caper/Plankton's Regular,6.7,279,08/05/2008,"The Patty Caper: The Krabby Patty formula has been placed in a vault far away for safe keeping. When Mr. Krabs forgets the recipe, he gives SpongeBob the key to the vault and sends him on a train ride to retrieve the formula. But someone steals the key! It's a mystery-aboard-a-train story as SpongeBob tries to locate the culprit, and he does it with the unlikeliest of allies ... Plankton! Plankton's Regular: Plankton has a customer who loves his chum and eats at the Chum Bucket every day-and no one is more surprised than Plankton. Could this mean competition for the ..."
109,6,9,Boating Buddies/The Krabby Kronicle,6.1,338,08/07/2008,"Boating Buddies: In an attempt to get away from SpongeBob, Squidward drives off in his boat as fast as he can. But he's stopped in his tracks when he's pulled over by a cop and is ordered to go to boating school. Now Squidward has to sit next to SpongeBob in class all day long and SpongeBob couldn't be happier! The Krabby Kronicle: When Mr. Krabs notices that the citizens of Bikini Bottom love buying tabloid newspapers, he decides to begin another business venture-his own tabloid! He recruits SpongeBob as his writer, but SpongeBob doesn't feel comfortable making up ..."
110,6,10,The Slumber Party/Grooming Gary,6.9,279,11/28/2008,"The Slumber Party: Pearl's getting ready for her slumber party, but Mr. Krabs' meddling in the party preparations is getting out of control. Pearl forces him out of the house and orders him to stay at SpongeBob's house until the party's over. But that doesn't stop Mr. Krabs from finding out what's going on at the party-he sends his #1 employee SpongeBob to be his undercover spy! Grooming Gary: SpongeBob decides to enter Gary in a pet show, but when he sees how well-groomed and well-dressed the other pets are, he realizes that he needs to give Gary a makeover. But Gary..."
111,6,11,SpongeBob SquarePants vs. The Big One,7.4,552,04/17/2009,"Spongebob and his friends are swept away by a giant wave and find themselves stranded on a remote tropical island. In order to get home, they must learn how to surf from enigmatic surf guru: Jack Kahuna Laguna."
112,6,12,Porous Pockets/Choir Boys,5.9,313,11/28/2008,"Porous Pockets: When SpongeBob suddenly becomes the richest citizen of Bikini Bottom, he finds himself surrounded by lots of new ""friends"" who are more than happy to help him spend his money. And as SpongeBob spends more time with his new friends, he's spending less time with his best buddy Patrick. Is this the end of their friendship? Choir Boys: It's the day of Squidward's big lead solo audition with the Bikini Bottom Men's Chorus, and Squidward is brimming with excitement. He's positive he's a shoo-in for the part. Now all he needs to do is get to the audition on ..."
113,6,13,Krusty Krushers/The Card,6.6,309,11/28/2008,"Krusty Krushers: Mr. Krabs hatches up yet another get-rich-quick scheme: professional wrestling! But Mr. Krabs isn't the one who's going to wrestle. He's going to be the manager and money-handler-for the newest tag-team wrestlers in Bikini Bottom: SpongeBob and Patrick! The Card: The new Mermaidman and Barnacleboy trading cards are on sale, and SpongeBob is determined to get the super special rare talking card, no matter how many packs of cards he needs to buy to find it. He buys packs upon packs of cards, but no luck. But when Patrick buys just one pack, he ..."
114,6,14,Dear Vikings/Ditchin',6.1,316,11/28/2008,"Dear Vikings: There's a new Viking-themed promotion at the Krusty Krab, so SpongeBob is determined to find out everything there is to know about Vikings. And what better way to find out about Vikings than to talk to them himself? So SpongeBob writes a letter to the Vikings, and is surprised when they decide to pay a visit to the Krusty Krab to answer his questions in person. Ditchin: Mermaidman and Barnacleboy are having a book signing, but SpongeBob can't go because he has boating school. After some convincing, Patrick finally gets SpongeBob to take a bathroom break ..."
115,6,15,Grandpappy the Pirate/Cephalopod Lodge,6.6,287,02/17/2009,"Grandpappy the Pirate: Mr. Krabs' granddad is coming to town! But instead of being excited, Mr. Krabs is nervous because his swarthy pirate granddad thinks that Mr. Krabs is a pirate, too. Will Mr. Krabs be able to fool his granddad into thinking that he, SpongeBob, and Squidward are pirates aboard a pirate ship, and not fast-food employees at the Krusty Krab? Cephalopod Lodge: When SpongeBob finds out that Squidward is a member of a secret society, SpongeBob decides he wants to join, too! The only problem is that the society is just for fish with tentacles. ..."
116,6,16,Squid's Visit/To Squarepants or Not to Squarepants,5.8,345,07/17/2009,"Spongebob's pants have shrunk in the dryer, so he buys some new, round pants, but no one recognises him."
117,6,17,Shuffleboarding/Professor Squidward,5.5,319,02/16/2009,A-SpongeBob and Patrick get carried away when they fill in for Mermaidman and Barnacleboy. B-Squidward poses as the teacher at a prestigious music school.
118,6,18,Pet or Pests/Komputer Overload,5.4,287,03/18/2009,"Pets or Pests: SpongeBob adopts a stray worm, and to his surprise, the worm gives birth to some worm babies overnight! But since Gary won't play nice, SpongeBob needs to find loving homes for his new slimy, weird-looking friends. Kumputer Overload: Plankton is sick of Karen's criticisms, so he decides he can just replace her with some new computer inventions! But when he takes them out on a Krabby Patty formula-stealing mission, he learns that Karen truly is one of a kind."
119,6,19,Gullible Pants/Overbooked,6.6,251,06/05/2009,"Gullible Pants: SpongeBob is left in charge of the Krusty Krab while Mr. Krabs steps out for 15 minutes, and he is determined to make it the best-managed 15 minutes ever! So when Squidward tells him that there are a lot of rules that he doesn't know about-like never interrupting Squidward's naps-SpongeBob is eager to learn and follow everything he says. Overbooked: SpongeBob's got a full day, and he's determined to do everything he's scheduled to do: help fix Mr. Krabs' telescope, go to Patrick's birthday party, and help with Sandy's science presentation. Too bad ..."
120,6,20,No Hat for Pat/Toy Store of Doom,6.9,308,03/17/2009,"No Hat for Pat: Patrick is sick of all of his friends not being able to play with him because they have to put on their Krusty Krab hats and go to work. So when Mr. Krabs offers him a job as a sign-holder, Patrick is thrilled because it means he gets to wear a hat and work with all his friends! But Pat soon learns that wearing a hat isn't as simple as it looks. Toy Store of Doom: A new toy store has opened up in Bikini Bottom, and SpongeBob and Patrick couldn't be happier! In fact, they are having so much fun at the toy store that they accidentally get locked in when ..."
121,6,21,Sand Castles in the Sand/Shell Shocked,7.8,358,06/01/2009,Spongebob breaks Gary's shell and tries to get him a new one at Angry Jack's Shell Imporium.
122,6,22,Chum Bucket Supreme/Single Cell Anniversary,7.4,264,06/03/2009,"Chum Bucket Supreme: None of Plankton's intellectually advanced advertising slogans for the Chum Bucket seem to be working. Plankton decides to switch gears by hiring someone who can create the dumbest slogans ever-Patrick! Single Cell Anniversary: It's Karen and Plankton's wedding anniversary, and Karen has gotten Plankton the best anniversary gift ever-the Krabby Patty formula! But she refuses to give it to him until Plankton gives her the best gift ever, too. If only he knew what that was!"
123,6,23,Truth or Square,5.7,456,11/06/2009,The cast look back on major events in their lives; Patchy hosts a star-studded anniversary special.
124,6,25,Pineapple Fever/Chum Caverns,6.9,293,07/18/2009,Plankton discovers an underground cave which he decides to convert into part of the Chum Bucket. The Chum Buket becomes popular because of the great scenery and threatens to put the Krusty Krabs out of business.
125,6,26,The Clash of Triton,5.2,337,07/05/2010,"King Neptune hosts a party, inviting all of the sea creatures. SpongeBob is jealous of the royal chef."
126,7,1,Tentacle-Vision/I Heart Dancing,6.7,321,07/19/2009,Tenacle-vison: Squidward becomes the star of his own public access TV show. I Heart Dancing: Squidward tries to sabotage SpongeBob's big dance audition.
127,7,2,Growth Spout/Stuck in the Wringer,4.3,443,07/19/2009,"Growth Spout: Mr. Krabs tries to find enough food to feed Pearl as she goes through her growth spurt. Stuck in the Wringer: After showering, SpongeBob gets stuck in his wringer."
128,7,3,Someone's in the Kitchen with Sandy/The Inside Job,5.8,308,07/19/2009,Someone's in the Kitchen with Sandy: Plankton steals Sandy's fur to disguise himself as Sandy and get the Krabby Patty formula. The Inside Job: Plankton goes inside SpongeBob's head to get the Krabby Patty formula.
129,7,4,Greasy Buffoons/Model Sponge,6.5,289,11/27/2009,Greasy Buffoons: Mr. Krabs and Plankton woo customers with greasy entrees. Model Sponge: SpongeBob tries a career at being a model in a kitchen sponge commercial.
